,abstract,affiliation,author,country,delete,issn_linking,journal,keywords,medline_ta,mesh_terms,nlm_unique_id,other_id,pmc,pmid,pubdate,title,abstract_tokenized,title_tokenzied,abstract_normalized
291,"A recent ecological study found a statistically significant association of attention deficit hyperactivity disorder (ADHD) prevalence in youth with exposure to fluoride in fluoridated water. However, it included only household income as a possible covariate. In contrast another study found a significant association of ADHD prevalence with residential altitude. A multiple regression analysis including water fluoridation extent, mean US state elevation and a number of possibly important social factors as covariates showed statistically significant associations of ADHD prevalence in 2011 with altitude and per capita personal income in 2009. There was no statistically significant association of ADHD with the exposure to fluoride when these covariates were included. The ADHD-fluoridation study suffers from insufficient consideration of possible risk-modifying factors but has been widely cited because its reported findings appear advantageous to political campaigns against community water fluoridation.","Making Sense of Fluoride Inc., 3 Seclusion Lane, Burwood, Christchurch 8083, New Zealand, 3216.",KW Perrott,England,False,0007-0610,British dental journal,,Br Dent J,,7513219,,,29192688,2017,Fluoridation and attention deficit hyperactivity disorder - a critique of Malin and Till (2015).,"['A', 'recent', 'ecological', 'study', 'found', 'a', 'statistically', 'significant', 'association', 'of', 'attention', 'deficit', 'hyperactivity', 'disorder', '(', 'ADHD', ')', 'prevalence', 'in', 'youth', 'with', 'exposure', 'to', 'fluoride', 'in', 'fluoridated', 'water', '.', 'However', ',', 'it', 'included', 'only', 'household', 'income', 'as', 'a', 'possible', 'covariate', '.', 'In', 'contrast', 'another', 'study', 'found', 'a', 'significant', 'association', 'of', 'ADHD', 'prevalence', 'with', 'residential', 'altitude', '.', 'A', 'multiple', 'regression', 'analysis', 'including', 'water', 'fluoridation', 'extent', ',', 'mean', 'US', 'state', 'elevation', 'and', 'a', 'number', 'of', 'possibly', 'important', 'social', 'factors', 'as', 'covariates', 'showed', 'statistically', 'significant', 'associations', 'of', 'ADHD', 'prevalence', 'in', '2011', 'with', 'altitude', 'and', 'per', 'capita', 'personal', 'income', 'in', '2009', '.', 'There', 'was', 'no', 'statistically', 'significant', 'association', 'of', 'ADHD', 'with', 'the', 'exposure', 'to', 'fluoride', 'when', 'these', 'covariates', 'were', 'included', '.', 'The', 'ADHD-fluoridation', 'study', 'suffers', 'from', 'insufficient', 'consideration', 'of', 'possible', 'risk-modifying', 'factors', 'but', 'has', 'been', 'widely', 'cited', 'because', 'its', 'reported', 'findings', 'appear', 'advantageous', 'to', 'political', 'campaigns', 'against', 'community', 'water', 'fluoridation', '.']","['Fluoridation', 'and', 'attention', 'deficit', 'hyperactivity', 'disorder', '-', 'a', 'critique', 'of', 'Malin', 'and', 'Till', '(', '2015', ')', '.']","['recent', 'ecological', 'study', 'found', 'statistically', 'significant', 'association', 'attention', 'deficit', 'hyperactivity', 'disorder', 'adhd', 'prevalence', 'youth', 'exposure', 'fluoride', 'fluoridated', 'water', 'however', 'included', 'household', 'income', 'possible', 'covariate', 'contrast', 'another', 'study', 'found', 'significant', 'association', 'adhd', 'prevalence', 'residential', 'altitude', 'multiple', 'regression', 'analysis', 'including', 'water', 'fluoridation', 'extent', 'mean', 'us', 'state', 'elevation', 'number', 'possibly', 'important', 'social', 'factors', 'covariates', 'showed', 'statistically', 'significant', 'associations', 'adhd', 'prevalence', 'altitude', 'per', 'capita', 'personal', 'income', 'statistically', 'significant', 'association', 'adhd', 'exposure', 'fluoride', 'covariates', 'included', 'study', 'suffers', 'insufficient', 'consideration', 'possible', 'factors', 'widely', 'cited', 'reported', 'findings', 'appear', 'advantageous', 'political', 'campaigns', 'community', 'water', 'fluoridation']"
292,"Explicitly-stated learning outcomes are an expected, integral part of contemporary under- and postgraduate learning programmes in dentistry. Writing learning outcomes, however, can be challenging and undertaken with a risk of not understanding what is meant by them and what well-constructed outcomes are meant to do. Written badly, learning outcomes will not help capture the goals of educational interventions or, perhaps worse, they end up as nothing more than a complex, frustrating hoop-jumping exercise in both their conception and utilisation. Underlying misconceptions of the purpose of learning outcomes or how to develop them are likely contributors to this situation. We would argue that if one understands the background, construct and intended purpose of learning outcomes we are more likely to write them so that they can actually be applied and therefore used effectively.","School of Medical Education, Newcastle University, UK.
School of Medical Education, Newcastle University, UK.
School of Medical Education, Newcastle University, UK.
School of Dental Sciences, Newcastle University, UK.",H Bateman; J Ellis; J Stewart; G McCracken,England,False,0007-0610,British dental journal,,Br Dent J,,7513219,,,29192689,2017,Using learning outcomes in dental education.,"['Explicitly-stated', 'learning', 'outcomes', 'are', 'an', 'expected', ',', 'integral', 'part', 'of', 'contemporary', 'under-', 'and', 'postgraduate', 'learning', 'programmes', 'in', 'dentistry', '.', 'Writing', 'learning', 'outcomes', ',', 'however', ',', 'can', 'be', 'challenging', 'and', 'undertaken', 'with', 'a', 'risk', 'of', 'not', 'understanding', 'what', 'is', 'meant', 'by', 'them', 'and', 'what', 'well-constructed', 'outcomes', 'are', 'meant', 'to', 'do', '.', 'Written', 'badly', ',', 'learning', 'outcomes', 'will', 'not', 'help', 'capture', 'the', 'goals', 'of', 'educational', 'interventions', 'or', ',', 'perhaps', 'worse', ',', 'they', 'end', 'up', 'as', 'nothing', 'more', 'than', 'a', 'complex', ',', 'frustrating', 'hoop-jumping', 'exercise', 'in', 'both', 'their', 'conception', 'and', 'utilisation', '.', 'Underlying', 'misconceptions', 'of', 'the', 'purpose', 'of', 'learning', 'outcomes', 'or', 'how', 'to', 'develop', 'them', 'are', 'likely', 'contributors', 'to', 'this', 'situation', '.', 'We', 'would', 'argue', 'that', 'if', 'one', 'understands', 'the', 'background', ',', 'construct', 'and', 'intended', 'purpose', 'of', 'learning', 'outcomes', 'we', 'are', 'more', 'likely', 'to', 'write', 'them', 'so', 'that', 'they', 'can', 'actually', 'be', 'applied', 'and', 'therefore', 'used', 'effectively', '.']","['Using', 'learning', 'outcomes', 'in', 'dental', 'education', '.']","['learning', 'outcomes', 'expected', 'integral', 'part', 'contemporary', 'postgraduate', 'learning', 'programmes', 'dentistry', 'writing', 'learning', 'outcomes', 'however', 'challenging', 'undertaken', 'risk', 'understanding', 'meant', 'outcomes', 'meant', 'written', 'badly', 'learning', 'outcomes', 'help', 'capture', 'goals', 'educational', 'interventions', 'perhaps', 'worse', 'end', 'nothing', 'complex', 'frustrating', 'exercise', 'conception', 'utilisation', 'underlying', 'misconceptions', 'purpose', 'learning', 'outcomes', 'develop', 'likely', 'contributors', 'situation', 'would', 'argue', 'one', 'understands', 'background', 'construct', 'intended', 'purpose', 'learning', 'outcomes', 'likely', 'write', 'actually', 'applied', 'therefore', 'used', 'effectively']"
293,"Alcohol is a very widely used drug which can cause dental disease and influence dental treatment. It is therefore important that dental professionals take an alcohol history from all patients and are aware of how to give alcohol reduction advice. This article discusses the impact of alcohol on oral health, including oral cancer, trauma, halitosis, tooth wear, periodontal disease and caries, with reference to the available literature. It also outlines current alcohol risk level advice and guidance regarding giving alcohol reduction advice in a dental setting.","DCT2, St George's Hospital, Blackshaw Road, London, SW17 0QT.",R Grocock,England,False,0007-0610,British dental journal,,Br Dent J,,7513219,,,29192690,2017,The relevance of alcohol to dental practice.,"['Alcohol', 'is', 'a', 'very', 'widely', 'used', 'drug', 'which', 'can', 'cause', 'dental', 'disease', 'and', 'influence', 'dental', 'treatment', '.', 'It', 'is', 'therefore', 'important', 'that', 'dental', 'professionals', 'take', 'an', 'alcohol', 'history', 'from', 'all', 'patients', 'and', 'are', 'aware', 'of', 'how', 'to', 'give', 'alcohol', 'reduction', 'advice', '.', 'This', 'article', 'discusses', 'the', 'impact', 'of', 'alcohol', 'on', 'oral', 'health', ',', 'including', 'oral', 'cancer', ',', 'trauma', ',', 'halitosis', ',', 'tooth', 'wear', ',', 'periodontal', 'disease', 'and', 'caries', ',', 'with', 'reference', 'to', 'the', 'available', 'literature', '.', 'It', 'also', 'outlines', 'current', 'alcohol', 'risk', 'level', 'advice', 'and', 'guidance', 'regarding', 'giving', 'alcohol', 'reduction', 'advice', 'in', 'a', 'dental', 'setting', '.']","['The', 'relevance', 'of', 'alcohol', 'to', 'dental', 'practice', '.']","['alcohol', 'widely', 'used', 'drug', 'cause', 'dental', 'disease', 'influence', 'dental', 'treatment', 'therefore', 'important', 'dental', 'professionals', 'take', 'alcohol', 'history', 'patients', 'aware', 'give', 'alcohol', 'reduction', 'advice', 'article', 'discusses', 'impact', 'alcohol', 'oral', 'health', 'including', 'oral', 'cancer', 'trauma', 'halitosis', 'tooth', 'wear', 'periodontal', 'disease', 'caries', 'reference', 'available', 'literature', 'also', 'outlines', 'current', 'alcohol', 'risk', 'level', 'advice', 'guidance', 'regarding', 'giving', 'alcohol', 'reduction', 'advice', 'dental', 'setting']"
294,"Introduction Communication within the doctor-patient relationship is complex due to a variety of reasons; a patient's understanding may not correspond with the clinician's vocabulary, resulting in misunderstanding, anxiety and ill-informed decision making. We investigated the understanding of terminology commonly used in oral and maxillofacial surgery and oral medicine clinics.Methods We investigated patients' understanding using a questionnaire-based study in the out-patient setting. Age, gender, first language and highest educational level were recorded. The questionnaire included multiple choice questions regarding patients' understanding of words as well as asking patients to define certain terms. Vocabulary included 'ulcer', 'blister', 'cancer', 'malignant' and 'benign'.Results and conclusions Many patients have difficulty in understanding and explaining commonly used terminology. 'Blister' was the most commonly understood term, while 'benign' and 'lesion' were the least well understood. 'Tumour' was mistakenly thought of as synonymous with 'malignancy' by over a third of patients. Understanding was better among those for whom English was their first language. It is essential that all clinicians modify their language appropriately during consultations in order to deliver information in a comprehensive manner, to educate patients on their condition thus enabling informed decision making by patients.","Department of Oral and Maxillofacial Surgery, King's College Hospital, London, UK.
Department of Oral and Maxillofacial Surgery, King's College Hospital, London, UK.
Department of Oral and Maxillofacial Surgery, King's College Hospital, London, UK.
Department of Oral and Maxillofacial Surgery, King's College Hospital, London, UK.",E Hayes; R Dua; E Yeung; K Fan,England,False,0007-0610,British dental journal,,Br Dent J,,7513219,,,29192691,2017,Patient understanding of commonly used oral medicine terminology.,"['Introduction', 'Communication', 'within', 'the', 'doctor-patient', 'relationship', 'is', 'complex', 'due', 'to', 'a', 'variety', 'of', 'reasons', ';', 'a', 'patient', ""'s"", 'understanding', 'may', 'not', 'correspond', 'with', 'the', 'clinician', ""'s"", 'vocabulary', ',', 'resulting', 'in', 'misunderstanding', ',', 'anxiety', 'and', 'ill-informed', 'decision', 'making', '.', 'We', 'investigated', 'the', 'understanding', 'of', 'terminology', 'commonly', 'used', 'in', 'oral', 'and', 'maxillofacial', 'surgery', 'and', 'oral', 'medicine', 'clinics.Methods', 'We', 'investigated', 'patients', ""'"", 'understanding', 'using', 'a', 'questionnaire-based', 'study', 'in', 'the', 'out-patient', 'setting', '.', 'Age', ',', 'gender', ',', 'first', 'language', 'and', 'highest', 'educational', 'level', 'were', 'recorded', '.', 'The', 'questionnaire', 'included', 'multiple', 'choice', 'questions', 'regarding', 'patients', ""'"", 'understanding', 'of', 'words', 'as', 'well', 'as', 'asking', 'patients', 'to', 'define', 'certain', 'terms', '.', 'Vocabulary', 'included', ""'ulcer"", ""'"", ',', ""'blister"", ""'"", ',', ""'cancer"", ""'"", ',', ""'malignant"", ""'"", 'and', ""'benign'.Results"", 'and', 'conclusions', 'Many', 'patients', 'have', 'difficulty', 'in', 'understanding', 'and', 'explaining', 'commonly', 'used', 'terminology', '.', ""'Blister"", ""'"", 'was', 'the', 'most', 'commonly', 'understood', 'term', ',', 'while', ""'benign"", ""'"", 'and', ""'lesion"", ""'"", 'were', 'the', 'least', 'well', 'understood', '.', ""'Tumour"", ""'"", 'was', 'mistakenly', 'thought', 'of', 'as', 'synonymous', 'with', ""'malignancy"", ""'"", 'by', 'over', 'a', 'third', 'of', 'patients', '.', 'Understanding', 'was', 'better', 'among', 'those', 'for', 'whom', 'English', 'was', 'their', 'first', 'language', '.', 'It', 'is', 'essential', 'that', 'all', 'clinicians', 'modify', 'their', 'language', 'appropriately', 'during', 'consultations', 'in', 'order', 'to', 'deliver', 'information', 'in', 'a', 'comprehensive', 'manner', ',', 'to', 'educate', 'patients', 'on', 'their', 'condition', 'thus', 'enabling', 'informed', 'decision', 'making', 'by', 'patients', '.']","['Patient', 'understanding', 'of', 'commonly', 'used', 'oral', 'medicine', 'terminology', '.']","['introduction', 'communication', 'within', 'relationship', 'complex', 'due', 'variety', 'reasons', 'patient', 'understanding', 'may', 'correspond', 'clinician', 'vocabulary', 'resulting', 'misunderstanding', 'anxiety', 'decision', 'making', 'investigated', 'understanding', 'terminology', 'commonly', 'used', 'oral', 'maxillofacial', 'surgery', 'oral', 'medicine', 'investigated', 'patients', 'understanding', 'using', 'study', 'setting', 'age', 'gender', 'first', 'language', 'highest', 'educational', 'level', 'recorded', 'questionnaire', 'included', 'multiple', 'choice', 'questions', 'regarding', 'patients', 'understanding', 'words', 'well', 'asking', 'patients', 'define', 'certain', 'terms', 'vocabulary', 'included', 'conclusions', 'many', 'patients', 'difficulty', 'understanding', 'explaining', 'commonly', 'used', 'terminology', 'commonly', 'understood', 'term', 'least', 'well', 'understood', 'mistakenly', 'thought', 'synonymous', 'third', 'patients', 'understanding', 'better', 'among', 'english', 'first', 'language', 'essential', 'clinicians', 'modify', 'language', 'appropriately', 'consultations', 'order', 'deliver', 'information', 'comprehensive', 'manner', 'educate', 'patients', 'condition', 'thus', 'enabling', 'informed', 'decision', 'making', 'patients']"
295,"Introduction Oral bisphosphonates are the most commonly prescribed anti-resorptive drugs used in the treatment of osteoporosis, but osteonecrosis of the jaw is a serious complication. The early diagnosis of this destructive side effect is crucial in preventing excessive bone loss, pain and infection.Objective To aid dental practitioners in the early identification of bisphosphonate-related osteonecrosis of the jaw.Method A scoping review was carried out.Data sources We searched MEDLINE via OVID, EMBASE via OVID, Dentistry and Oral Sciences Source (DOSS), Proquest Dissertation and Theses Search, to identify references that described clinical and radiological findings in medication-related osteonecrosis of the jaw (MRONJ).Data selection Nineteen references mentioned the earliest radiological changes in MRONJ with a description of the observations and were included in the analysis.Data synthesis The radiographic signs included osteosclerosis/lysis, widening of the periodontal ligament and thickening of the lamina dura and cortex. To assess the quality of original data on which recommendations had been made, these 19 studies were subjected to a quality appraisal.Conclusion Using bone exposure as a criterion for diagnosis of MRONJ, leads to delayed diagnosis and a poor response to treatment. In those patients at risk of bone exposure with MRONJ, insufficient information is present in the literature to allow the general dental practitioner to reliably identify the radiographic features indicating imminent bone exposure. A well-designed prospective study is needed.","Division of Dentistry, School of Medical Sciences, Faculty of Biology, Medicine and Health, University of Manchester, Manchester Academic Health Science Centre, Manchester, M13 9PL, UK.
Division of Dentistry, School of Medical Sciences, Faculty of Biology, Medicine and Health, University of Manchester, Manchester Academic Health Science Centre, Manchester, M13 9PL, UK.
General Dental practitioner, Bloxham Dental Practice, Godswell Stables, Bloxham, OX15 4ES, UK.
Research Associate, The University of Manchester & Central Manchester University Hospitals Foundation Trust.
Information Specialist, Cochrane Oral Health, Division of Dentistry, School of Medical Sciences, Faculty of Biology, Medicine and Health, University of Manchester, Manchester Academic Health Science Centre, Manchester, M13 9PL, UK.
Professor. School of Medical Sciences, Faculty of Biology, Medicine and Health, University of Manchester, Manchester Academic Health Science Centre, Manchester, M13 9PL, UK.",H Devlin; J Greenwall-Cohen; J Benton; TL Goodwin; A Littlewood; K Horner,England,False,0007-0610,British dental journal,,Br Dent J,,7513219,,,29192692,2017,Detecting the earliest radiological signs of bisphosphonate-related osteonecrosis.,"['Introduction', 'Oral', 'bisphosphonates', 'are', 'the', 'most', 'commonly', 'prescribed', 'anti-resorptive', 'drugs', 'used', 'in', 'the', 'treatment', 'of', 'osteoporosis', ',', 'but', 'osteonecrosis', 'of', 'the', 'jaw', 'is', 'a', 'serious', 'complication', '.', 'The', 'early', 'diagnosis', 'of', 'this', 'destructive', 'side', 'effect', 'is', 'crucial', 'in', 'preventing', 'excessive', 'bone', 'loss', ',', 'pain', 'and', 'infection.Objective', 'To', 'aid', 'dental', 'practitioners', 'in', 'the', 'early', 'identification', 'of', 'bisphosphonate-related', 'osteonecrosis', 'of', 'the', 'jaw.Method', 'A', 'scoping', 'review', 'was', 'carried', 'out.Data', 'sources', 'We', 'searched', 'MEDLINE', 'via', 'OVID', ',', 'EMBASE', 'via', 'OVID', ',', 'Dentistry', 'and', 'Oral', 'Sciences', 'Source', '(', 'DOSS', ')', ',', 'Proquest', 'Dissertation', 'and', 'Theses', 'Search', ',', 'to', 'identify', 'references', 'that', 'described', 'clinical', 'and', 'radiological', 'findings', 'in', 'medication-related', 'osteonecrosis', 'of', 'the', 'jaw', '(', 'MRONJ', ')', '.Data', 'selection', 'Nineteen', 'references', 'mentioned', 'the', 'earliest', 'radiological', 'changes', 'in', 'MRONJ', 'with', 'a', 'description', 'of', 'the', 'observations', 'and', 'were', 'included', 'in', 'the', 'analysis.Data', 'synthesis', 'The', 'radiographic', 'signs', 'included', 'osteosclerosis/lysis', ',', 'widening', 'of', 'the', 'periodontal', 'ligament', 'and', 'thickening', 'of', 'the', 'lamina', 'dura', 'and', 'cortex', '.', 'To', 'assess', 'the', 'quality', 'of', 'original', 'data', 'on', 'which', 'recommendations', 'had', 'been', 'made', ',', 'these', '19', 'studies', 'were', 'subjected', 'to', 'a', 'quality', 'appraisal.Conclusion', 'Using', 'bone', 'exposure', 'as', 'a', 'criterion', 'for', 'diagnosis', 'of', 'MRONJ', ',', 'leads', 'to', 'delayed', 'diagnosis', 'and', 'a', 'poor', 'response', 'to', 'treatment', '.', 'In', 'those', 'patients', 'at', 'risk', 'of', 'bone', 'exposure', 'with', 'MRONJ', ',', 'insufficient', 'information', 'is', 'present', 'in', 'the', 'literature', 'to', 'allow', 'the', 'general', 'dental', 'practitioner', 'to', 'reliably', 'identify', 'the', 'radiographic', 'features', 'indicating', 'imminent', 'bone', 'exposure', '.', 'A', 'well-designed', 'prospective', 'study', 'is', 'needed', '.']","['Detecting', 'the', 'earliest', 'radiological', 'signs', 'of', 'bisphosphonate-related', 'osteonecrosis', '.']","['introduction', 'oral', 'bisphosphonates', 'commonly', 'prescribed', 'drugs', 'used', 'treatment', 'osteoporosis', 'osteonecrosis', 'jaw', 'serious', 'complication', 'early', 'diagnosis', 'destructive', 'side', 'effect', 'crucial', 'preventing', 'excessive', 'bone', 'loss', 'pain', 'aid', 'dental', 'practitioners', 'early', 'identification', 'osteonecrosis', 'scoping', 'review', 'carried', 'sources', 'searched', 'medline', 'via', 'ovid', 'embase', 'via', 'ovid', 'dentistry', 'oral', 'sciences', 'source', 'doss', 'proquest', 'dissertation', 'theses', 'search', 'identify', 'references', 'described', 'clinical', 'radiological', 'findings', 'osteonecrosis', 'jaw', 'mronj', 'selection', 'nineteen', 'references', 'mentioned', 'earliest', 'radiological', 'changes', 'mronj', 'description', 'observations', 'included', 'synthesis', 'radiographic', 'signs', 'included', 'widening', 'periodontal', 'ligament', 'thickening', 'lamina', 'dura', 'cortex', 'assess', 'quality', 'original', 'data', 'recommendations', 'made', 'studies', 'subjected', 'quality', 'using', 'bone', 'exposure', 'criterion', 'diagnosis', 'mronj', 'leads', 'delayed', 'diagnosis', 'poor', 'response', 'treatment', 'patients', 'risk', 'bone', 'exposure', 'mronj', 'insufficient', 'information', 'present', 'literature', 'allow', 'general', 'dental', 'practitioner', 'reliably', 'identify', 'radiographic', 'features', 'indicating', 'imminent', 'bone', 'exposure', 'prospective', 'study', 'needed']"
