,abstract,affiliation,author,country,delete,issn_linking,journal,keywords,medline_ta,mesh_terms,nlm_unique_id,other_id,pmc,pmid,pubdate,title,abstract_tokenized,title_tokenzied,abstract_normalized
344,"PURPOSE
Two randomized trials in the cytokine era showed that cytoreductive nephrectomy (CN) had a role in metastatic renal cell carcinoma (mRCC), increasing life expectancy. The survival benefit of tyrosine kinase inhibitors (TKIs), including first-line sunitinib and pazopanib, in mRCC has been demonstrated, but the majority of patients enrolled in the pivotal phase III studies had undergone nephrectomy. Therefore it is unknown if similar survival benefit with targeted agents could be achieved without CN. We hypothesize that in these patients CN could increase overall survival (OS) in comparison to targeted therapy without CN. We also will investigate mechanisms of primary and secondary resistance to TKIs in patients with mRCC and identify prognostic or predictive biomarkers.


METHODS
This is a randomized, open-label, controlled, multicenter phase 3 study comparing sunitinib or pazopanib vs CN followed by sunitinib or pazopanib as first-line therapy for patients with mRCC who have not received surgery and prior systemic treatment for metastatic disease. We will identify 270 patients eligible for randomization. The planned treatment duration per patient will be until progressive disease is observed. Secondary endpoints are the evaluation of progression-free survival (PFS) and response rate and the assessment of the safety profile. Exploratory objectives include the evaluation of circulating tumor cells and circulating tumor DNA and correlation with response/resistance to treatment.


RESULTS
The study is enrolling patients.


CONCLUSIONS
The use of CN in addition to targeted therapy in patients with renal cell carcinoma with synchronous metastases could lead to a significant improvement in OS and PFS.","Department of Medical Oncology, Fondazione IRCCS Istituto Nazionale Tumori, Milan - Italy.
Department of Medical Oncology, Fondazione IRCCS Istituto Nazionale Tumori, Milan - Italy.
Department of Medical Oncology, Fondazione IRCCS Istituto Nazionale Tumori, Milan - Italy.
Department of Urology, Fondazione IRCCS Istituto Nazionale Tumori, Milan - Italy.
Department of Urology, Fondazione IRCCS Istituto Nazionale Tumori, Milan - Italy.
Clinical Trial Center, Fondazione IRCCS Istituto Nazionale Tumori, Milan - Italy.
Department of Medical Oncology, Fondazione IRCCS Istituto Nazionale Tumori, Milan - Italy.
Biomarker Unit, Department of Experimental Oncology and Molecular Medicine, Fondazione IRCCS Istituto Nazionale Tumori, Milan - Italy.
Biomarker Unit, Department of Experimental Oncology and Molecular Medicine, Fondazione IRCCS Istituto Nazionale Tumori, Milan - Italy.
Department of Medical Oncology, Istituto Scientifico Romagnolo per lo Studio e la Cura dei Tumori (IRST) IRCCS, Meldola (Forlì-Cesena) - Italy.
Department of Medical Oncology, Fondazione IRCCS Istituto Nazionale Tumori, Milan - Italy.",E Verzoni; R Ratta; P Grassi; R Salvioni; S Stagni; R Montone; G Fucà; V Cappelletti; C Reduzzi; U De Giorgi; G Procopio,Italy,False,0300-8916,Tumori,,Tumori,,0111356,,,29192741,2017,TARIBO trial: targeted therapy with or without nephrectomy in metastatic renal cell carcinoma: liquid biopsy for biomarkers discovery.,"['PURPOSE', 'Two', 'randomized', 'trials', 'in', 'the', 'cytokine', 'era', 'showed', 'that', 'cytoreductive', 'nephrectomy', '(', 'CN', ')', 'had', 'a', 'role', 'in', 'metastatic', 'renal', 'cell', 'carcinoma', '(', 'mRCC', ')', ',', 'increasing', 'life', 'expectancy', '.', 'The', 'survival', 'benefit', 'of', 'tyrosine', 'kinase', 'inhibitors', '(', 'TKIs', ')', ',', 'including', 'first-line', 'sunitinib', 'and', 'pazopanib', ',', 'in', 'mRCC', 'has', 'been', 'demonstrated', ',', 'but', 'the', 'majority', 'of', 'patients', 'enrolled', 'in', 'the', 'pivotal', 'phase', 'III', 'studies', 'had', 'undergone', 'nephrectomy', '.', 'Therefore', 'it', 'is', 'unknown', 'if', 'similar', 'survival', 'benefit', 'with', 'targeted', 'agents', 'could', 'be', 'achieved', 'without', 'CN', '.', 'We', 'hypothesize', 'that', 'in', 'these', 'patients', 'CN', 'could', 'increase', 'overall', 'survival', '(', 'OS', ')', 'in', 'comparison', 'to', 'targeted', 'therapy', 'without', 'CN', '.', 'We', 'also', 'will', 'investigate', 'mechanisms', 'of', 'primary', 'and', 'secondary', 'resistance', 'to', 'TKIs', 'in', 'patients', 'with', 'mRCC', 'and', 'identify', 'prognostic', 'or', 'predictive', 'biomarkers', '.', 'METHODS', 'This', 'is', 'a', 'randomized', ',', 'open-label', ',', 'controlled', ',', 'multicenter', 'phase', '3', 'study', 'comparing', 'sunitinib', 'or', 'pazopanib', 'vs', 'CN', 'followed', 'by', 'sunitinib', 'or', 'pazopanib', 'as', 'first-line', 'therapy', 'for', 'patients', 'with', 'mRCC', 'who', 'have', 'not', 'received', 'surgery', 'and', 'prior', 'systemic', 'treatment', 'for', 'metastatic', 'disease', '.', 'We', 'will', 'identify', '270', 'patients', 'eligible', 'for', 'randomization', '.', 'The', 'planned', 'treatment', 'duration', 'per', 'patient', 'will', 'be', 'until', 'progressive', 'disease', 'is', 'observed', '.', 'Secondary', 'endpoints', 'are', 'the', 'evaluation', 'of', 'progression-free', 'survival', '(', 'PFS', ')', 'and', 'response', 'rate', 'and', 'the', 'assessment', 'of', 'the', 'safety', 'profile', '.', 'Exploratory', 'objectives', 'include', 'the', 'evaluation', 'of', 'circulating', 'tumor', 'cells', 'and', 'circulating', 'tumor', 'DNA', 'and', 'correlation', 'with', 'response/resistance', 'to', 'treatment', '.', 'RESULTS', 'The', 'study', 'is', 'enrolling', 'patients', '.', 'CONCLUSIONS', 'The', 'use', 'of', 'CN', 'in', 'addition', 'to', 'targeted', 'therapy', 'in', 'patients', 'with', 'renal', 'cell', 'carcinoma', 'with', 'synchronous', 'metastases', 'could', 'lead', 'to', 'a', 'significant', 'improvement', 'in', 'OS', 'and', 'PFS', '.']","['TARIBO', 'trial', ':', 'targeted', 'therapy', 'with', 'or', 'without', 'nephrectomy', 'in', 'metastatic', 'renal', 'cell', 'carcinoma', ':', 'liquid', 'biopsy', 'for', 'biomarkers', 'discovery', '.']","['purpose', 'two', 'randomized', 'trials', 'cytokine', 'era', 'showed', 'cytoreductive', 'nephrectomy', 'cn', 'role', 'metastatic', 'renal', 'cell', 'carcinoma', 'mrcc', 'increasing', 'life', 'expectancy', 'survival', 'benefit', 'tyrosine', 'kinase', 'inhibitors', 'tkis', 'including', 'sunitinib', 'pazopanib', 'mrcc', 'demonstrated', 'majority', 'patients', 'enrolled', 'pivotal', 'phase', 'iii', 'studies', 'undergone', 'nephrectomy', 'therefore', 'unknown', 'similar', 'survival', 'benefit', 'targeted', 'agents', 'could', 'achieved', 'without', 'cn', 'hypothesize', 'patients', 'cn', 'could', 'increase', 'overall', 'survival', 'os', 'comparison', 'targeted', 'therapy', 'without', 'cn', 'also', 'investigate', 'mechanisms', 'primary', 'secondary', 'resistance', 'tkis', 'patients', 'mrcc', 'identify', 'prognostic', 'predictive', 'biomarkers', 'methods', 'randomized', 'controlled', 'multicenter', 'phase', 'study', 'comparing', 'sunitinib', 'pazopanib', 'vs', 'cn', 'followed', 'sunitinib', 'pazopanib', 'therapy', 'patients', 'mrcc', 'received', 'surgery', 'prior', 'systemic', 'treatment', 'metastatic', 'disease', 'identify', 'patients', 'eligible', 'randomization', 'planned', 'treatment', 'duration', 'per', 'patient', 'progressive', 'disease', 'observed', 'secondary', 'endpoints', 'evaluation', 'survival', 'pfs', 'response', 'rate', 'assessment', 'safety', 'profile', 'exploratory', 'objectives', 'include', 'evaluation', 'circulating', 'tumor', 'cells', 'circulating', 'tumor', 'dna', 'correlation', 'treatment', 'results', 'study', 'enrolling', 'patients', 'conclusions', 'use', 'cn', 'addition', 'targeted', 'therapy', 'patients', 'renal', 'cell', 'carcinoma', 'synchronous', 'metastases', 'could', 'lead', 'significant', 'improvement', 'os', 'pfs']"
345,"INTRODUCTION
Rhabdomyosarcoma is a soft tissue malignant musculoskeletal tumor frequent in children. Biliary duct localization is extremely rare, but it is the most common cause of malignant obstructive jaundice in pediatric patients.


METHODS
This report describes a series of 10 patients under 18 years of age with biliary tract rhabdomyosarcoma who were enrolled, from 1979 to 2004, in 3 consecutive Italian pediatric cooperative protocols that had been drawn up by the Soft Tissue Sarcoma Committee of the Associazione Italiana Ematologia Oncologia Pediatrica (AIEOP).


RESULTS
Considering initial and delayed surgery, tumor resection was achieved in 7 cases, 3 complete with free margins (2 liver transplants) and 4 with microscopic residual disease. Chemotherapy was given to all patients and radiotherapy to 3. At present, 5 patients survive in complete remission 90-200 months after diagnosis while 4 died of disease progression or relapse and 1 of liver transplant-related complications.


CONCLUSIONS
Better outcomes in this series were associated with the feasibility of conservative surgery due to the favorable location of the tumor, in particular in the common bile duct. Chemotherapy and radiotherapy might obviate the need for demolitive surgery or liver transplant, which were linked to worse outcomes in our series.","Pediatric Hematology/Oncology Unit, S. Maria della Misericordia Hospital, Perugia - Italy.
Pediatric Hematology/Oncology Unit, Department of Hematology, Transfusion Medicine and Biotechnology, Pescara - Italy.
Pediatric Hematology/Oncology Division, Padua University, Padua - Italy.
Pediatric Hematology/Oncology Unit, Papa Giovanni XXIII Hospital, Bergamo - Italy.
Hematology/Oncology Division, Ospedale Pediatrico Bambino Gesù IRCCS, Rome - Italy.
Pediatric Onco-Hematology, Stem Cell Transplantation and Cellular Therapy Division, Regina Margherita Children's Hospital, Turin - Italy.
Department of Pediatric Hematology/Oncology, Giannina Gaslini Children's Hospital, Genoa - Italy.
Pediatric Surgery, Padua University, Padua - Italy.
Pathology Department, Padua University, Padua - Italy.
Pediatric Oncology Service, Department of Pediatrics, Second University, Naples - Italy.
Pediatric Hematology/Oncology Unit, La Sapienza University, Rome - Italy.
Department of Pediatrics, University of Bologna, S. Orsola-Malpighi Hospital, Bologna - Italy.
Pediatric Hematology/Oncology Division, Padua University, Padua - Italy.
Pediatric Oncology Unit, Fondazione IRCCS Istituto Nazionale Tumori, Milan - Italy.
Pediatric Hematology/Oncology Unit, Casa Sollievo della Sofferenza, S.G. Rotondo (Foggia) - Italy.
Pediatric Hematology/Oncology Unit, Azienda Ospedaliera Universitaria Integrata, Verona - Italy.
Hematology/Oncology Unit, Meyer Pediatric Hospital, Florence - Italy.
Pediatric Hematology/Oncology Division, Padua University, Padua - Italy.
Pediatric Oncology Unit, Fondazione IRCCS Istituto Nazionale Tumori, Milan - Italy.",K Perruccio; V Cecinati; A Scagnellato; M Provenzi; G Maria Milano; E Basso; C Manzitti; G Cecchetto; R Alaggio; M Di Martino; A Schiavetti; F Melchionda; M Carmen Affinita; S Chiaravalli; L Miglionico; R Balter; A Tamburini; G Bisogno; A Ferrari,Italy,False,0300-8916,Tumori,,Tumori,,0111356,,,29192742,2017,Biliary tract rhabdomyosarcoma: a report from the Soft Tissue Sarcoma Committee of the Associazione Italiana Ematologia Oncologia Pediatrica.,"['INTRODUCTION', 'Rhabdomyosarcoma', 'is', 'a', 'soft', 'tissue', 'malignant', 'musculoskeletal', 'tumor', 'frequent', 'in', 'children', '.', 'Biliary', 'duct', 'localization', 'is', 'extremely', 'rare', ',', 'but', 'it', 'is', 'the', 'most', 'common', 'cause', 'of', 'malignant', 'obstructive', 'jaundice', 'in', 'pediatric', 'patients', '.', 'METHODS', 'This', 'report', 'describes', 'a', 'series', 'of', '10', 'patients', 'under', '18', 'years', 'of', 'age', 'with', 'biliary', 'tract', 'rhabdomyosarcoma', 'who', 'were', 'enrolled', ',', 'from', '1979', 'to', '2004', ',', 'in', '3', 'consecutive', 'Italian', 'pediatric', 'cooperative', 'protocols', 'that', 'had', 'been', 'drawn', 'up', 'by', 'the', 'Soft', 'Tissue', 'Sarcoma', 'Committee', 'of', 'the', 'Associazione', 'Italiana', 'Ematologia', 'Oncologia', 'Pediatrica', '(', 'AIEOP', ')', '.', 'RESULTS', 'Considering', 'initial', 'and', 'delayed', 'surgery', ',', 'tumor', 'resection', 'was', 'achieved', 'in', '7', 'cases', ',', '3', 'complete', 'with', 'free', 'margins', '(', '2', 'liver', 'transplants', ')', 'and', '4', 'with', 'microscopic', 'residual', 'disease', '.', 'Chemotherapy', 'was', 'given', 'to', 'all', 'patients', 'and', 'radiotherapy', 'to', '3', '.', 'At', 'present', ',', '5', 'patients', 'survive', 'in', 'complete', 'remission', '90-200', 'months', 'after', 'diagnosis', 'while', '4', 'died', 'of', 'disease', 'progression', 'or', 'relapse', 'and', '1', 'of', 'liver', 'transplant-related', 'complications', '.', 'CONCLUSIONS', 'Better', 'outcomes', 'in', 'this', 'series', 'were', 'associated', 'with', 'the', 'feasibility', 'of', 'conservative', 'surgery', 'due', 'to', 'the', 'favorable', 'location', 'of', 'the', 'tumor', ',', 'in', 'particular', 'in', 'the', 'common', 'bile', 'duct', '.', 'Chemotherapy', 'and', 'radiotherapy', 'might', 'obviate', 'the', 'need', 'for', 'demolitive', 'surgery', 'or', 'liver', 'transplant', ',', 'which', 'were', 'linked', 'to', 'worse', 'outcomes', 'in', 'our', 'series', '.']","['Biliary', 'tract', 'rhabdomyosarcoma', ':', 'a', 'report', 'from', 'the', 'Soft', 'Tissue', 'Sarcoma', 'Committee', 'of', 'the', 'Associazione', 'Italiana', 'Ematologia', 'Oncologia', 'Pediatrica', '.']","['introduction', 'rhabdomyosarcoma', 'soft', 'tissue', 'malignant', 'musculoskeletal', 'tumor', 'frequent', 'children', 'biliary', 'duct', 'localization', 'extremely', 'rare', 'common', 'cause', 'malignant', 'obstructive', 'jaundice', 'pediatric', 'patients', 'methods', 'report', 'describes', 'series', 'patients', 'years', 'age', 'biliary', 'tract', 'rhabdomyosarcoma', 'enrolled', 'consecutive', 'italian', 'pediatric', 'cooperative', 'protocols', 'drawn', 'soft', 'tissue', 'sarcoma', 'committee', 'associazione', 'italiana', 'ematologia', 'oncologia', 'pediatrica', 'aieop', 'results', 'considering', 'initial', 'delayed', 'surgery', 'tumor', 'resection', 'achieved', 'cases', 'complete', 'free', 'margins', 'liver', 'transplants', 'microscopic', 'residual', 'disease', 'chemotherapy', 'given', 'patients', 'radiotherapy', 'present', 'patients', 'survive', 'complete', 'remission', 'months', 'diagnosis', 'died', 'disease', 'progression', 'relapse', 'liver', 'complications', 'conclusions', 'better', 'outcomes', 'series', 'associated', 'feasibility', 'conservative', 'surgery', 'due', 'favorable', 'location', 'tumor', 'particular', 'common', 'bile', 'duct', 'chemotherapy', 'radiotherapy', 'might', 'obviate', 'need', 'demolitive', 'surgery', 'liver', 'transplant', 'linked', 'worse', 'outcomes', 'series']"
346,"INTRODUCTION
Pancreatic cancer is a leading cause of cancer-related death. Its diagnosis is often delayed and patients are frequently found to have unresectable disease. Patients diagnosed with new-onset diabetes have an 8-fold risk of harboring pancreatic cancer. Adrenomedullin has been claimed to mediate diabetes in pancreatic cancer. New screening tools are needed to develop an early diagnosis protocol.


METHODS
Patients aged 45-75 years within 2 years of first fulfilling the ADA criteria for diabetes will be prospectively enrolled in this study. Sepsis, renal failure, microangiopathy, pregnancy, acute heart failure and previous malignancies will be considered as exclusion criteria.


RESULTS
440 patients diagnosed with new-onset diabetes will be enrolled and divided into 2 groups: one with high adrenomedullin levels and one with low adrenomedullin levels. Patients will undergo 3 years' follow-up to detect pancreatic cancer development.


CONCLUSIONS
Identifying a marker for pancreatic cancer among high-risk patients such as new-onset diabetics might lead to the identification of a subpopulation needing to be screened in order to enable early diagnosis and treatment of a highly lethal tumor.


TRIAL REGISTRATION
This trial was registered at ClinicalTrials.gov on May 25, 2015 under registration number NCT02456051.","General Surgery, St. Andrea University Hospital, Faculty of Medicine and Psychology, Sapienza University, Rome - Italy.
Internal Medicine, St. Andrea University Hospital, Faculty of Medicine and Psychology, Sapienza University, Rome - Italy.
Internal Medicine, St. Andrea University Hospital, Faculty of Medicine and Psychology, Sapienza University, Rome - Italy.
Occupational Medicine, St. Andrea University Hospital, Faculty of Medicine and Psychology, Sapienza University, Rome - Italy.
General Surgery, St. Andrea University Hospital, Faculty of Medicine and Psychology, Sapienza University, Rome - Italy.
Endocrinology and Diabetology, St. Andrea University Hospital, Faculty of Medicine and Psychology, Sapienza University, Rome - Italy.
General Surgery, St. Andrea University Hospital, Faculty of Medicine and Psychology, Sapienza University, Rome - Italy.
General Surgery, St. Andrea University Hospital, Faculty of Medicine and Psychology, Sapienza University, Rome - Italy.",L Antolino; M La Rocca; F Todde; E Catarinozzi; P Aurello; L Bollanti; G Ramacciato; F D'Angelo,Italy,False,0300-8916,Tumori,,Tumori,,0111356,,,29192743,2017,Can pancreatic cancer be detected by adrenomedullin in patients with new-onset diabetes? The PaCANOD cohort study protocol.,"['INTRODUCTION', 'Pancreatic', 'cancer', 'is', 'a', 'leading', 'cause', 'of', 'cancer-related', 'death', '.', 'Its', 'diagnosis', 'is', 'often', 'delayed', 'and', 'patients', 'are', 'frequently', 'found', 'to', 'have', 'unresectable', 'disease', '.', 'Patients', 'diagnosed', 'with', 'new-onset', 'diabetes', 'have', 'an', '8-fold', 'risk', 'of', 'harboring', 'pancreatic', 'cancer', '.', 'Adrenomedullin', 'has', 'been', 'claimed', 'to', 'mediate', 'diabetes', 'in', 'pancreatic', 'cancer', '.', 'New', 'screening', 'tools', 'are', 'needed', 'to', 'develop', 'an', 'early', 'diagnosis', 'protocol', '.', 'METHODS', 'Patients', 'aged', '45-75', 'years', 'within', '2', 'years', 'of', 'first', 'fulfilling', 'the', 'ADA', 'criteria', 'for', 'diabetes', 'will', 'be', 'prospectively', 'enrolled', 'in', 'this', 'study', '.', 'Sepsis', ',', 'renal', 'failure', ',', 'microangiopathy', ',', 'pregnancy', ',', 'acute', 'heart', 'failure', 'and', 'previous', 'malignancies', 'will', 'be', 'considered', 'as', 'exclusion', 'criteria', '.', 'RESULTS', '440', 'patients', 'diagnosed', 'with', 'new-onset', 'diabetes', 'will', 'be', 'enrolled', 'and', 'divided', 'into', '2', 'groups', ':', 'one', 'with', 'high', 'adrenomedullin', 'levels', 'and', 'one', 'with', 'low', 'adrenomedullin', 'levels', '.', 'Patients', 'will', 'undergo', '3', 'years', ""'"", 'follow-up', 'to', 'detect', 'pancreatic', 'cancer', 'development', '.', 'CONCLUSIONS', 'Identifying', 'a', 'marker', 'for', 'pancreatic', 'cancer', 'among', 'high-risk', 'patients', 'such', 'as', 'new-onset', 'diabetics', 'might', 'lead', 'to', 'the', 'identification', 'of', 'a', 'subpopulation', 'needing', 'to', 'be', 'screened', 'in', 'order', 'to', 'enable', 'early', 'diagnosis', 'and', 'treatment', 'of', 'a', 'highly', 'lethal', 'tumor', '.', 'TRIAL', 'REGISTRATION', 'This', 'trial', 'was', 'registered', 'at', 'ClinicalTrials.gov', 'on', 'May', '25', ',', '2015', 'under', 'registration', 'number', 'NCT02456051', '.']","['Can', 'pancreatic', 'cancer', 'be', 'detected', 'by', 'adrenomedullin', 'in', 'patients', 'with', 'new-onset', 'diabetes', '?', 'The', 'PaCANOD', 'cohort', 'study', 'protocol', '.']","['introduction', 'pancreatic', 'cancer', 'leading', 'cause', 'death', 'diagnosis', 'often', 'delayed', 'patients', 'frequently', 'found', 'unresectable', 'disease', 'patients', 'diagnosed', 'diabetes', 'risk', 'harboring', 'pancreatic', 'cancer', 'adrenomedullin', 'claimed', 'mediate', 'diabetes', 'pancreatic', 'cancer', 'new', 'screening', 'tools', 'needed', 'develop', 'early', 'diagnosis', 'protocol', 'methods', 'patients', 'aged', 'years', 'within', 'years', 'first', 'fulfilling', 'ada', 'criteria', 'diabetes', 'prospectively', 'enrolled', 'study', 'sepsis', 'renal', 'failure', 'microangiopathy', 'pregnancy', 'acute', 'heart', 'failure', 'previous', 'malignancies', 'considered', 'exclusion', 'criteria', 'results', 'patients', 'diagnosed', 'diabetes', 'enrolled', 'divided', 'groups', 'one', 'high', 'adrenomedullin', 'levels', 'one', 'low', 'adrenomedullin', 'levels', 'patients', 'undergo', 'years', 'detect', 'pancreatic', 'cancer', 'development', 'conclusions', 'identifying', 'marker', 'pancreatic', 'cancer', 'among', 'patients', 'diabetics', 'might', 'lead', 'identification', 'subpopulation', 'needing', 'screened', 'order', 'enable', 'early', 'diagnosis', 'treatment', 'highly', 'lethal', 'tumor', 'trial', 'registration', 'trial', 'registered', 'may', 'registration', 'number']"
