,abstract,affiliation,author,country,delete,issn_linking,journal,keywords,medline_ta,mesh_terms,nlm_unique_id,other_id,pmc,pmid,pubdate,title,abstract_tokenized,title_tokenzied,abstract_normalized
245,"Gastric signet ring cell carcinoma (SRCC) is a rare form of highly malignant adenocarcinoma. It is an epithelial malignancy characterized by the histologic appearance of more than 50% of cells as signet ring cells filled with mucin. The incidence of SRCC is rising,[1],[2] therefore, the diagnosis of these cancers in the early stage is important as it is the only stage that curative measures can be done. A 49-year-old female was hospitalized due to epigastric pain, postprandial bloating for 3 months. Upper gastrointestinal endoscopy with narrow band imaging (NBI) showed 1.5 cm lesion in the lesser curvature of the stomach with irregular pit pattern and accentuated vascularization of the surrounding mucosa. Histopathology confirmed the presence of more than 50% of the cells as signet ring cells. We report on the importance of optical diagnosis in early gastric cancer with the help of NBI, the subsequent patient management, and prognosis.","Department of Gastroenterology, Targu Mures County Hospital, Targu Mures, Romania.
Department of Histopathology, Emergency Clinical County Hospital, Targu Mures, Romania.
Department of Surgery, Emergency Clinical County Hospital, Targu Mures, Romania.
Department of Gastroenterology, Targu Mures County Hospital, Targu Mures, Romania.",PS Akabah; S Mocan; C Molnar; D Dobru,India,False,,Nigerian journal of clinical practice,,Niger J Clin Pract,,101150032,,,29192642,2017,Importance of optical diagnosis in early gastric cancer: A case report of early gastric signet ring cell carcinoma.,"['Gastric', 'signet', 'ring', 'cell', 'carcinoma', '(', 'SRCC', ')', 'is', 'a', 'rare', 'form', 'of', 'highly', 'malignant', 'adenocarcinoma', '.', 'It', 'is', 'an', 'epithelial', 'malignancy', 'characterized', 'by', 'the', 'histologic', 'appearance', 'of', 'more', 'than', '50', '%', 'of', 'cells', 'as', 'signet', 'ring', 'cells', 'filled', 'with', 'mucin', '.', 'The', 'incidence', 'of', 'SRCC', 'is', 'rising', ',', '[', '1', ']', ',', '[', '2', ']', 'therefore', ',', 'the', 'diagnosis', 'of', 'these', 'cancers', 'in', 'the', 'early', 'stage', 'is', 'important', 'as', 'it', 'is', 'the', 'only', 'stage', 'that', 'curative', 'measures', 'can', 'be', 'done', '.', 'A', '49-year-old', 'female', 'was', 'hospitalized', 'due', 'to', 'epigastric', 'pain', ',', 'postprandial', 'bloating', 'for', '3', 'months', '.', 'Upper', 'gastrointestinal', 'endoscopy', 'with', 'narrow', 'band', 'imaging', '(', 'NBI', ')', 'showed', '1.5', 'cm', 'lesion', 'in', 'the', 'lesser', 'curvature', 'of', 'the', 'stomach', 'with', 'irregular', 'pit', 'pattern', 'and', 'accentuated', 'vascularization', 'of', 'the', 'surrounding', 'mucosa', '.', 'Histopathology', 'confirmed', 'the', 'presence', 'of', 'more', 'than', '50', '%', 'of', 'the', 'cells', 'as', 'signet', 'ring', 'cells', '.', 'We', 'report', 'on', 'the', 'importance', 'of', 'optical', 'diagnosis', 'in', 'early', 'gastric', 'cancer', 'with', 'the', 'help', 'of', 'NBI', ',', 'the', 'subsequent', 'patient', 'management', ',', 'and', 'prognosis', '.']","['Importance', 'of', 'optical', 'diagnosis', 'in', 'early', 'gastric', 'cancer', ':', 'A', 'case', 'report', 'of', 'early', 'gastric', 'signet', 'ring', 'cell', 'carcinoma', '.']","['gastric', 'signet', 'ring', 'cell', 'carcinoma', 'srcc', 'rare', 'form', 'highly', 'malignant', 'adenocarcinoma', 'epithelial', 'malignancy', 'characterized', 'histologic', 'appearance', 'cells', 'signet', 'ring', 'cells', 'filled', 'mucin', 'incidence', 'srcc', 'rising', 'therefore', 'diagnosis', 'cancers', 'early', 'stage', 'important', 'stage', 'curative', 'measures', 'done', 'female', 'hospitalized', 'due', 'epigastric', 'pain', 'postprandial', 'bloating', 'months', 'upper', 'gastrointestinal', 'endoscopy', 'narrow', 'band', 'imaging', 'nbi', 'showed', 'cm', 'lesion', 'lesser', 'curvature', 'stomach', 'irregular', 'pit', 'pattern', 'accentuated', 'vascularization', 'surrounding', 'mucosa', 'histopathology', 'confirmed', 'presence', 'cells', 'signet', 'ring', 'cells', 'report', 'importance', 'optical', 'diagnosis', 'early', 'gastric', 'cancer', 'help', 'nbi', 'subsequent', 'patient', 'management', 'prognosis']"
246,"Multiple primary tumors occur in clinical practice causing diagnostic dilemma. It is not very common, but the incidence has increased gradually since it was first described very many years ago. However, in spite of its increasing incidence, the presence of such primary malignancies in the breast and colon has been rare and far between, as against its presence in breast and lungs, both breasts, colon and stomach, two colonic sites, and endometrium and ovaries. It could be due to genetic disorders such as Li-Fraumeni syndrome in which case the affected individuals develop multiple cancers in childhood or early adulthood. This is, however, very rare. It could be due to metastasis of one cancer to another site. The challenge is making a correct diagnosis and giving the appropriate management. Erroneously handling one as a metastasis of the other and instituting management as such would be inappropriate. It is necessary to make proper clinical and histopathological diagnosis and to institute proper management. We report the case of a woman who had primary cancers involving rare organ combinations of the breast and ascending colon.","Department of Surgery, Federal Medical Centre, Lagos, Nigeria.
Department of Surgery, Federal Medical Centre, Lagos, Nigeria.",MA Adeyanju; AA Ilori,India,False,,Nigerian journal of clinical practice,,Niger J Clin Pract,,101150032,,,29192643,2017,Multiple primary tumors.,"['Multiple', 'primary', 'tumors', 'occur', 'in', 'clinical', 'practice', 'causing', 'diagnostic', 'dilemma', '.', 'It', 'is', 'not', 'very', 'common', ',', 'but', 'the', 'incidence', 'has', 'increased', 'gradually', 'since', 'it', 'was', 'first', 'described', 'very', 'many', 'years', 'ago', '.', 'However', ',', 'in', 'spite', 'of', 'its', 'increasing', 'incidence', ',', 'the', 'presence', 'of', 'such', 'primary', 'malignancies', 'in', 'the', 'breast', 'and', 'colon', 'has', 'been', 'rare', 'and', 'far', 'between', ',', 'as', 'against', 'its', 'presence', 'in', 'breast', 'and', 'lungs', ',', 'both', 'breasts', ',', 'colon', 'and', 'stomach', ',', 'two', 'colonic', 'sites', ',', 'and', 'endometrium', 'and', 'ovaries', '.', 'It', 'could', 'be', 'due', 'to', 'genetic', 'disorders', 'such', 'as', 'Li-Fraumeni', 'syndrome', 'in', 'which', 'case', 'the', 'affected', 'individuals', 'develop', 'multiple', 'cancers', 'in', 'childhood', 'or', 'early', 'adulthood', '.', 'This', 'is', ',', 'however', ',', 'very', 'rare', '.', 'It', 'could', 'be', 'due', 'to', 'metastasis', 'of', 'one', 'cancer', 'to', 'another', 'site', '.', 'The', 'challenge', 'is', 'making', 'a', 'correct', 'diagnosis', 'and', 'giving', 'the', 'appropriate', 'management', '.', 'Erroneously', 'handling', 'one', 'as', 'a', 'metastasis', 'of', 'the', 'other', 'and', 'instituting', 'management', 'as', 'such', 'would', 'be', 'inappropriate', '.', 'It', 'is', 'necessary', 'to', 'make', 'proper', 'clinical', 'and', 'histopathological', 'diagnosis', 'and', 'to', 'institute', 'proper', 'management', '.', 'We', 'report', 'the', 'case', 'of', 'a', 'woman', 'who', 'had', 'primary', 'cancers', 'involving', 'rare', 'organ', 'combinations', 'of', 'the', 'breast', 'and', 'ascending', 'colon', '.']","['Multiple', 'primary', 'tumors', '.']","['multiple', 'primary', 'tumors', 'occur', 'clinical', 'practice', 'causing', 'diagnostic', 'dilemma', 'common', 'incidence', 'increased', 'gradually', 'since', 'first', 'described', 'many', 'years', 'ago', 'however', 'spite', 'increasing', 'incidence', 'presence', 'primary', 'malignancies', 'breast', 'colon', 'rare', 'far', 'presence', 'breast', 'lungs', 'breasts', 'colon', 'stomach', 'two', 'colonic', 'sites', 'endometrium', 'ovaries', 'could', 'due', 'genetic', 'disorders', 'syndrome', 'case', 'affected', 'individuals', 'develop', 'multiple', 'cancers', 'childhood', 'early', 'adulthood', 'however', 'rare', 'could', 'due', 'metastasis', 'one', 'cancer', 'another', 'site', 'challenge', 'making', 'correct', 'diagnosis', 'giving', 'appropriate', 'management', 'erroneously', 'handling', 'one', 'metastasis', 'instituting', 'management', 'would', 'inappropriate', 'necessary', 'make', 'proper', 'clinical', 'histopathological', 'diagnosis', 'institute', 'proper', 'management', 'report', 'case', 'woman', 'primary', 'cancers', 'involving', 'rare', 'organ', 'combinations', 'breast', 'ascending', 'colon']"
247,"Therapeutic plasma exchange (TPE) is performed frequently and effectively in developed countries, whereas the reverse is the case in developing countries. Guillain-Barre syndrome (GBS), synonymous with acute inflammatory demyelinating polyneuropathy, is an important indication for TPE, but this is rarely administered in the treatment of such patients in Nigeria due to lack of such automated facility, limited expertise, and high cost. This report therefore presents an uncommon case of GBS in which automated TPE was utilized in the management, with the aims of highlighting the current status and challenges of therapeutic apheresis services in Nigeria. A 42-year-old male presented with rapidly progressive (in an ascending fashion) paralysis of all four limbs within 24 h without any preceding history of fever or other symptoms. Clinical examination revealed a young man, afebrile, not pale, and also not dehydrated. Central nervous system examination showed a conscious man, alert, and oriented in time, person, and place. There were no signs of meningeal irritation and the cranial nerves were grossly intact. There was no power in the limbs: global hypotonia and areflexia were noted on examination. However, he had intact sensory perceptions to touch and pain. Following a diagnosis of GBS, he was treated with four sessions of plasmapheresis and TPE. The TPE session was done using a discontinuous flow apheresis machine which exchanged one plasma volume (3 L of plasma) and 5% albumin used for replacement. The patient made gradual but steady recovery as return of power to the upper limbs and trunk started by the 2nd week of treatment. TPE is an important treatment modality in the management of GBS as well as several other conditions, and it is becoming increasingly available in Nigeria. However, it is still grossly underutilized, thus the need for more therapeutic apheresis facilities and trained personnel, in addition to concerted efforts to subsidize the cost of accessing the treatment.","Department of Haematology and Blood Transfusion, University of Calabar Teaching Hospital, Calabar, Nigeria.
Department of Haematology and Blood Transfusion, University of Calabar Teaching Hospital, Calabar, Nigeria.
New York Blood Center, New York, NY 10065, USA.
New York Blood Center, New York, NY 10065, USA.",OE Iheanacho; C Chimeziem; BS Sachais; PA Shi,India,False,,Nigerian journal of clinical practice,,Niger J Clin Pract,,101150032,,,29192644,2017,"Automated (Centrifugal) therapeutic plasma exchange option for guillain-barre syndrome: A report from Calabar, Nigeria.","['Therapeutic', 'plasma', 'exchange', '(', 'TPE', ')', 'is', 'performed', 'frequently', 'and', 'effectively', 'in', 'developed', 'countries', ',', 'whereas', 'the', 'reverse', 'is', 'the', 'case', 'in', 'developing', 'countries', '.', 'Guillain-Barre', 'syndrome', '(', 'GBS', ')', ',', 'synonymous', 'with', 'acute', 'inflammatory', 'demyelinating', 'polyneuropathy', ',', 'is', 'an', 'important', 'indication', 'for', 'TPE', ',', 'but', 'this', 'is', 'rarely', 'administered', 'in', 'the', 'treatment', 'of', 'such', 'patients', 'in', 'Nigeria', 'due', 'to', 'lack', 'of', 'such', 'automated', 'facility', ',', 'limited', 'expertise', ',', 'and', 'high', 'cost', '.', 'This', 'report', 'therefore', 'presents', 'an', 'uncommon', 'case', 'of', 'GBS', 'in', 'which', 'automated', 'TPE', 'was', 'utilized', 'in', 'the', 'management', ',', 'with', 'the', 'aims', 'of', 'highlighting', 'the', 'current', 'status', 'and', 'challenges', 'of', 'therapeutic', 'apheresis', 'services', 'in', 'Nigeria', '.', 'A', '42-year-old', 'male', 'presented', 'with', 'rapidly', 'progressive', '(', 'in', 'an', 'ascending', 'fashion', ')', 'paralysis', 'of', 'all', 'four', 'limbs', 'within', '24', 'h', 'without', 'any', 'preceding', 'history', 'of', 'fever', 'or', 'other', 'symptoms', '.', 'Clinical', 'examination', 'revealed', 'a', 'young', 'man', ',', 'afebrile', ',', 'not', 'pale', ',', 'and', 'also', 'not', 'dehydrated', '.', 'Central', 'nervous', 'system', 'examination', 'showed', 'a', 'conscious', 'man', ',', 'alert', ',', 'and', 'oriented', 'in', 'time', ',', 'person', ',', 'and', 'place', '.', 'There', 'were', 'no', 'signs', 'of', 'meningeal', 'irritation', 'and', 'the', 'cranial', 'nerves', 'were', 'grossly', 'intact', '.', 'There', 'was', 'no', 'power', 'in', 'the', 'limbs', ':', 'global', 'hypotonia', 'and', 'areflexia', 'were', 'noted', 'on', 'examination', '.', 'However', ',', 'he', 'had', 'intact', 'sensory', 'perceptions', 'to', 'touch', 'and', 'pain', '.', 'Following', 'a', 'diagnosis', 'of', 'GBS', ',', 'he', 'was', 'treated', 'with', 'four', 'sessions', 'of', 'plasmapheresis', 'and', 'TPE', '.', 'The', 'TPE', 'session', 'was', 'done', 'using', 'a', 'discontinuous', 'flow', 'apheresis', 'machine', 'which', 'exchanged', 'one', 'plasma', 'volume', '(', '3', 'L', 'of', 'plasma', ')', 'and', '5', '%', 'albumin', 'used', 'for', 'replacement', '.', 'The', 'patient', 'made', 'gradual', 'but', 'steady', 'recovery', 'as', 'return', 'of', 'power', 'to', 'the', 'upper', 'limbs', 'and', 'trunk', 'started', 'by', 'the', '2nd', 'week', 'of', 'treatment', '.', 'TPE', 'is', 'an', 'important', 'treatment', 'modality', 'in', 'the', 'management', 'of', 'GBS', 'as', 'well', 'as', 'several', 'other', 'conditions', ',', 'and', 'it', 'is', 'becoming', 'increasingly', 'available', 'in', 'Nigeria', '.', 'However', ',', 'it', 'is', 'still', 'grossly', 'underutilized', ',', 'thus', 'the', 'need', 'for', 'more', 'therapeutic', 'apheresis', 'facilities', 'and', 'trained', 'personnel', ',', 'in', 'addition', 'to', 'concerted', 'efforts', 'to', 'subsidize', 'the', 'cost', 'of', 'accessing', 'the', 'treatment', '.']","['Automated', '(', 'Centrifugal', ')', 'therapeutic', 'plasma', 'exchange', 'option', 'for', 'guillain-barre', 'syndrome', ':', 'A', 'report', 'from', 'Calabar', ',', 'Nigeria', '.']","['therapeutic', 'plasma', 'exchange', 'tpe', 'performed', 'frequently', 'effectively', 'developed', 'countries', 'whereas', 'reverse', 'case', 'developing', 'countries', 'syndrome', 'gbs', 'synonymous', 'acute', 'inflammatory', 'demyelinating', 'polyneuropathy', 'important', 'indication', 'tpe', 'rarely', 'administered', 'treatment', 'patients', 'nigeria', 'due', 'lack', 'automated', 'facility', 'limited', 'expertise', 'high', 'cost', 'report', 'therefore', 'presents', 'uncommon', 'case', 'gbs', 'automated', 'tpe', 'utilized', 'management', 'aims', 'highlighting', 'current', 'status', 'challenges', 'therapeutic', 'apheresis', 'services', 'nigeria', 'male', 'presented', 'rapidly', 'progressive', 'ascending', 'fashion', 'paralysis', 'four', 'limbs', 'within', 'h', 'without', 'preceding', 'history', 'fever', 'symptoms', 'clinical', 'examination', 'revealed', 'young', 'man', 'afebrile', 'pale', 'also', 'dehydrated', 'central', 'nervous', 'system', 'examination', 'showed', 'conscious', 'man', 'alert', 'oriented', 'time', 'person', 'place', 'signs', 'meningeal', 'irritation', 'cranial', 'nerves', 'grossly', 'intact', 'power', 'limbs', 'global', 'hypotonia', 'areflexia', 'noted', 'examination', 'however', 'intact', 'sensory', 'perceptions', 'touch', 'pain', 'following', 'diagnosis', 'gbs', 'treated', 'four', 'sessions', 'plasmapheresis', 'tpe', 'tpe', 'session', 'done', 'using', 'discontinuous', 'flow', 'apheresis', 'machine', 'exchanged', 'one', 'plasma', 'volume', 'l', 'plasma', 'albumin', 'used', 'replacement', 'patient', 'made', 'gradual', 'steady', 'recovery', 'return', 'power', 'upper', 'limbs', 'trunk', 'started', 'week', 'treatment', 'tpe', 'important', 'treatment', 'modality', 'management', 'gbs', 'well', 'several', 'conditions', 'becoming', 'increasingly', 'available', 'nigeria', 'however', 'still', 'grossly', 'underutilized', 'thus', 'need', 'therapeutic', 'apheresis', 'facilities', 'trained', 'personnel', 'addition', 'concerted', 'efforts', 'subsidize', 'cost', 'accessing', 'treatment']"
248,"Aberrant differentiation of keratinocytes has been demonstrated to be associated with a number of skin diseases. A growing number of studies have showed that long noncoding RNAs (lncRNAs) have an important part in gene regulation, however, the role of lncRNAs in keratinocyte differentiation remains to be largely unknown. In the present study, we demonstrated that lncRNA-H19 act as an endogenous 'sponge', which binds directly to miR-130b-3p and therefore inhibits its activity on Dsg1. MiR-130b-3p was illustrated to inhibit keratinocyte differentiation by targeting Dsg1. H19 regulates Dsg1 expression and the consequent keratinocyte differentiation through miR-130b-3p. Our study casts light on a novel regulatory model of keratinocyte differentiation, which may provide new therapeutic targets of skin diseases.","Department of Dermatology, Xinhua Hospital, Shanghai Jiaotong University School of Medicine, Shanghai, China.
Department of Dermatology, Xinhua Hospital, Shanghai Jiaotong University School of Medicine, Shanghai, China.
Department of Dermatology, Xinhua Hospital, Shanghai Jiaotong University School of Medicine, Shanghai, China.
Department of Dermatology, Xinhua Hospital, Shanghai Jiaotong University School of Medicine, Shanghai, China.
Department of Dermatology, Xinhua Hospital, Shanghai Jiaotong University School of Medicine, Shanghai, China.
Department of Dermatology, Xinhua Hospital, Shanghai Jiaotong University School of Medicine, Shanghai, China.
Department of Dermatology, Xinhua Hospital, Shanghai Jiaotong University School of Medicine, Shanghai, China.
Department of Dermatology, Xinhua Hospital, Shanghai Jiaotong University School of Medicine, Shanghai, China.",CX Li; HG Li; LT Huang; YW Kong; FY Chen; JY Liang; H Yu; ZR Yao,England,False,,Cell death & disease,,Cell Death Dis,,101524092,,,29192645,2017,H19 lncRNA regulates keratinocyte differentiation by targeting miR-130b-3p.,"['Aberrant', 'differentiation', 'of', 'keratinocytes', 'has', 'been', 'demonstrated', 'to', 'be', 'associated', 'with', 'a', 'number', 'of', 'skin', 'diseases', '.', 'A', 'growing', 'number', 'of', 'studies', 'have', 'showed', 'that', 'long', 'noncoding', 'RNAs', '(', 'lncRNAs', ')', 'have', 'an', 'important', 'part', 'in', 'gene', 'regulation', ',', 'however', ',', 'the', 'role', 'of', 'lncRNAs', 'in', 'keratinocyte', 'differentiation', 'remains', 'to', 'be', 'largely', 'unknown', '.', 'In', 'the', 'present', 'study', ',', 'we', 'demonstrated', 'that', 'lncRNA-H19', 'act', 'as', 'an', 'endogenous', ""'sponge"", ""'"", ',', 'which', 'binds', 'directly', 'to', 'miR-130b-3p', 'and', 'therefore', 'inhibits', 'its', 'activity', 'on', 'Dsg1', '.', 'MiR-130b-3p', 'was', 'illustrated', 'to', 'inhibit', 'keratinocyte', 'differentiation', 'by', 'targeting', 'Dsg1', '.', 'H19', 'regulates', 'Dsg1', 'expression', 'and', 'the', 'consequent', 'keratinocyte', 'differentiation', 'through', 'miR-130b-3p', '.', 'Our', 'study', 'casts', 'light', 'on', 'a', 'novel', 'regulatory', 'model', 'of', 'keratinocyte', 'differentiation', ',', 'which', 'may', 'provide', 'new', 'therapeutic', 'targets', 'of', 'skin', 'diseases', '.']","['H19', 'lncRNA', 'regulates', 'keratinocyte', 'differentiation', 'by', 'targeting', 'miR-130b-3p', '.']","['aberrant', 'differentiation', 'keratinocytes', 'demonstrated', 'associated', 'number', 'skin', 'diseases', 'growing', 'number', 'studies', 'showed', 'long', 'noncoding', 'rnas', 'lncrnas', 'important', 'part', 'gene', 'regulation', 'however', 'role', 'lncrnas', 'keratinocyte', 'differentiation', 'remains', 'largely', 'unknown', 'present', 'study', 'demonstrated', 'act', 'endogenous', 'binds', 'directly', 'therefore', 'inhibits', 'activity', 'illustrated', 'inhibit', 'keratinocyte', 'differentiation', 'targeting', 'regulates', 'expression', 'consequent', 'keratinocyte', 'differentiation', 'study', 'casts', 'light', 'novel', 'regulatory', 'model', 'keratinocyte', 'differentiation', 'may', 'provide', 'new', 'therapeutic', 'targets', 'skin', 'diseases']"
